<?xml version="1.0" encoding="UTF-8" ?>
<!DOCTYPE librairie SYSTEM "librairieDTD.dtd">

<librairie>

    <en-tete>
        <img src="smah" title="Salut">Ceci est une image</img>
        &copyright;
        <em>CRDOC Rodez</em>
        <strong>A l'IUT de Rodez</strong>
    </en-tete>

    <livre isbn="7891">
        <titre>Le tour du monde en 80 jours</titre>
        <auteur>
            <nom>Vernes</nom>
            <prenom>Jules</prenom>
        </auteur>

        <description>
            <strong>Le tour du monde en 80</strong>
            <em>Fineas Fogg</em>
            <img src="/images" title="une planette">Illusatration</img>
        </description>

        <prix valeur="35" devise="dollar" tva="5.5"/>
    </livre>
</librairie>